{"stampede_index_trajectory":[13.9,14.2,14.6,15.1,15.6,16.2,16.8,17.6,18.5,19.5,20.5,21.7,23.0,24.5,26.0,27.5,29.2,30.9,32.5,34.2,35.9,37.5,39.0,40.5,41.8,43.1,44.2,45.2,46.1,46.9,47.6,48.3,48.8,49.3,49.7,50.0,50.4,50.6,50.8,51.0,51.2,51.3,51.4,51.5,51.6,51.7,51.7,51.8,51.8,51.9,51.9,51.9,52.0,52.0,52.0,52.0,52.0,52.0,52.0,52.0],"ai_index_trajectory":[12.0,12.3,12.6,13.0,13.3,13.6,13.9,14.2,14.6,14.9,15.2,15.5,15.7,15.6,15.5,15.3,15.2,15.1,15.0,14.9,14.8,14.7,14.6,14.5,14.4,14.3,14.3,14.2,14.1,14.0,14.0,13.9,13.9,13.8,13.8,13.7,13.7,13.6,13.6,13.6,13.5,13.5,13.4,13.4,13.4,13.4,13.3,13.3,13.3,13.3,13.2,13.2,13.2,13.2,13.2,13.1,13.1,13.1,13.1,13.1],"node_states":[{"id":"port_kaohsiung","capacity_pct":0.74,"is_bottleneck":false,"lane_price_delta":0.04},{"id":"port_shanghai","capacity_pct":0.88,"is_bottleneck":false,"lane_price_delta":0.06},{"id":"port_busan","capacity_pct":0.35,"is_bottleneck":false,"lane_price_delta":0.01},{"id":"port_singapore","capacity_pct":0.79,"is_bottleneck":false,"lane_price_delta":0.08},{"id":"port_rotterdam","capacity_pct":0.78,"is_bottleneck":false,"lane_price_delta":0.01},{"id":"port_losangeles","capacity_pct":0.41,"is_bottleneck":false,"lane_price_delta":0.03},{"id":"port_hamburg","capacity_pct":0.49,"is_bottleneck":false,"lane_price_delta":0.03},{"id":"port_dubai","capacity_pct":0.64,"is_bottleneck":false,"lane_price_delta":0.07},{"id":"port_mumbai","capacity_pct":0.69,"is_bottleneck":false,"lane_price_delta":0.08},{"id":"port_tokyo","capacity_pct":0.32,"is_bottleneck":true,"lane_price_delta":0.25},{"id":"port_longbeach","capacity_pct":0.55,"is_bottleneck":false,"lane_price_delta":0.08},{"id":"port_shenzhen","capacity_pct":0.84,"is_bottleneck":false,"lane_price_delta":0.04},{"id":"port_hochiminh","capacity_pct":0.4,"is_bottleneck":false,"lane_price_delta":0.02},{"id":"port_santos","capacity_pct":0.76,"is_bottleneck":false,"lane_price_delta":0.02},{"id":"port_colombo","capacity_pct":0.28,"is_bottleneck":false,"lane_price_delta":0.0},{"id":"factory_tw_semi_1","capacity_pct":0.4,"is_bottleneck":false,"lane_price_delta":0.09},{"id":"factory_tw_semi_2","capacity_pct":0.61,"is_bottleneck":false,"lane_price_delta":0.0},{"id":"factory_tw_semi_3","capacity_pct":0.76,"is_bottleneck":false,"lane_price_delta":0.01},{"id":"factory_tw_semi_4","capacity_pct":0.22,"is_bottleneck":true,"lane_price_delta":0.17},{"id":"factory_tw_semi_5","capacity_pct":0.32,"is_bottleneck":false,"lane_price_delta":0.01},{"id":"factory_tw_semi_6","capacity_pct":0.72,"is_bottleneck":false,"lane_price_delta":0.0},{"id":"factory_cn_elec_1","capacity_pct":0.58,"is_bottleneck":false,"lane_price_delta":0.1},{"id":"factory_cn_elec_2","capacity_pct":0.75,"is_bottleneck":false,"lane_price_delta":0.01},{"id":"factory_cn_elec_3","capacity_pct":0.58,"is_bottleneck":false,"lane_price_delta":0.06},{"id":"factory_cn_elec_4","capacity_pct":0.7,"is_bottleneck":false,"lane_price_delta":0.01},{"id":"factory_cn_elec_5","capacity_pct":0.37,"is_bottleneck":false,"lane_price_delta":0.04},{"id":"factory_cn_elec_6","capacity_pct":0.72,"is_bottleneck":false,"lane_price_delta":0.05},{"id":"factory_kr_chip_1","capacity_pct":0.42,"is_bottleneck":false,"lane_price_delta":0.08},{"id":"factory_kr_chip_2","capacity_pct":0.37,"is_bottleneck":false,"lane_price_delta":0.02},{"id":"factory_kr_chip_3","capacity_pct":0.36,"is_bottleneck":true,"lane_price_delta":0.26}],"density_field_snapshot":[[0.015686494359365227,0.014789706205953084,0.013176555343045657,0.013353665758702114,0.014894773130384405,0.015587633346845575],[0.01584565410192358,0.015130693998357928,0.013841088189144962,0.014517987187055032,0.015327446099336582,0.015842989097837813],[0.01614561486865527,0.01569938090931644,0.014628944866652048,0.01537813346028731,0.015930115438509994,0.016318036032167162],[0.015509910483569405,0.015370196955254383,0.015175827998158361,0.01601622839660312,0.016543135831072378,0.01682667875685747],[0.015044665412596223,0.015129955207209621,0.015953330401484316,0.01662268000484773,0.017217217283402992,0.017425728076173458],[0.015821725156965595,0.015691946791163192,0.016541263445055153,0.017221386616498066,0.017892016104024834,0.01800193598603191],[0.01662146156186415,0.016792183048033992,0.017227524726722933,0.0178240065393098,0.01831686660320106,0.0184797270947907],[0.017154892580743947,0.01732465629049977,0.01773234481813246,0.0183601657563837,0.018628086412569488,0.01881447120494148],[0.017587250925708668,0.01764253780708663,0.017923705842341126,0.018635083817121527,0.018850012178486662,0.01909318206618621],[0.01772664483509781,0.017852251521070193,0.018176177412145403,0.018772726974863388,0.019112400135775618,0.019250898546414968]],"meta_herd_detected":false,"entropy_budget_active":false,"frame_id":34,"params":{"beta":0.3,"adoption_pct":0.6,"shock_intensity":0.7}}